[
    {
        "name": "clangd",
        "user": "clangd",
        "repo": "clangd",
        "file_pattern": "clangd-linux-###.zip",
        "bin_dir_pattern": "clangd_###/bin",
        "uncompress_cmd": "unzip",
        "uncompress": true
    },
    {
        "name": "code-minimap",
        "user": "wfxr",
        "repo": "code-minimap",
        "file_pattern": "code-minimap-###-x86_64-unknown-linux-gnu.tar.gz",
        "bin_dir_pattern": "code-minimap-###-x86_64-unknown-linux-gnu",
        "uncompress_cmd": "tar",
        "uncompress_flags": "zxf",
        "uncompress": true
    },
    {
        "name": "gh",
        "user": "cli",
        "repo": "cli",
        "file_pattern": "gh_###_linux_amd64.tar.gz",
        "tag_replace": ["v",""],
        "bin_dir_pattern": "gh_###_linux_amd64/bin",
        "uncompress_cmd": "tar",
        "uncompress_flags": "zxf",
        "uncompress": true
    },
    {
        "name": "clang",
        "user": "llvm",
        "repo": "llvm-project",
        "file_pattern": "clang+llvm-###-x86_64-linux-gnu-ubuntu-18.04.tar.xz",
        "tag_replace": ["llvmorg-",""],
        "bin_dir_pattern": "clang+llvm-###-x86_64-linux-gnu-ubuntu-18.04.tar.xz",
        "uncompress_cmd": "tar",
        "uncompress_flags": "xf",
        "releases": "llvmorg-14.0.0",
        "uncompress": true
    },
    {
        "name": "rg",
        "user": "BurntSushi",
        "repo": "ripgrep",
        "file_pattern": "ripgrep-###-x86_64-unknown-linux-musl.tar.gz",
        "bin_dir_pattern": "ripgrep-###-x86_64-unknown-linux-musl",
        "copy_to_bin": true,
        "uncompress_cmd": "tar",
        "uncompress_flags": "zxf",
        "uncompress": true
    },
    {
        "name": "difft",
        "user": "Wilfred",
        "repo": "difftastic",
        "file_pattern": "difft-x86_64-unknown-linux-gnu.tar.gz",
        "bin_dir_pattern": "",
        "copy_to_bin": true,
        "uncompress_cmd": "tar",
        "uncompress_flags": "zxf",
        "uncompress": true
    },
    {
        "name": "zoxide",
        "user": "ajeetdsouza",
        "repo": "zoxide",
        "file_pattern": "zoxide-###-x86_64-unknown-linux-musl.tar.gz",
        "bin_dir_pattern": "",
        "copy_to_bin": true,
        "uncompress_cmd": "tar",
        "uncompress_flags": "zxf",
        "tag_replace": ["v",""],
        "uncompress": true
    },
    {
        "name": "bat",
        "user": "sharkdp",
        "repo": "bat",
        "file_pattern": "bat-###-x86_64-unknown-linux-musl.tar.gz",
        "bin_dir_pattern": "bat-###-x86_64-unknown-linux-musl",
        "copy_to_bin": true,
        "uncompress_cmd": "tar",
        "uncompress_flags": "zxf",
        "uncompress": true
    },
    {
        "name": "lf",
        "user": "gokcehan",
        "repo": "lf",
        "file_pattern": "lf-linux-amd64.tar.gz",
        "uncompress_cmd": "tar",
        "uncompress_flags": "zxf",
        "uncompress": true,
        "bin_dir_pattern": "",
        "copy_to_bin": true
    },
    {
        "name": "glow",
        "user": "charmbracelet",
        "repo": "glow",
        "file_pattern": "glow_1.4.1_linux_x86_64.tar.gz",
        "uncompress_cmd": "tar",
        "uncompress_flags": "zxf",
        "uncompress": true,
        "bin_dir_pattern": "",
        "copy_to_bin": true,
        "tag_replace": ["v",""]
    },
    {
        "name": "broot",
        "user": "Canop",
        "repo": "broot",
        "tag_replace": ["v",""],
        "file_pattern": "broot_###.zip",
        "uncompress_cmd": "unzip",
        "uncompress_flags": "-dbroot_all",
        "uncompress": true,
        "bin_dir_pattern": "broot_all/build/x86_64-unknown-linux-musl"
    },
    {
        "name": "pandoc",
        "user": "jgm",
        "repo": "pandoc",
        "file_pattern": "pandoc-###-linux-amd64.tar.gz",
        "uncompress_cmd": "tar",
        "uncompress_flags": "zxf",
        "uncompress": true,
        "bin_dir_pattern": "pandoc-###-linux-amd64/bin"
    },
    {
        "name": "nvim",
        "user": "neovim",
        "repo": "neovim",
        "file_pattern": "nvim-linux64.tar.gz",
        "uncompress_cmd": "tar",
        "uncompress_flags": "zxf",
        "uncompress": true,
        "bin_dir_pattern": "nvim-linux64/bin",
        "releases": "v0.7.0"
    },
    {
        "name": "jq",
        "user": "stedolan",
        "repo": "jq",
        "file_pattern": "jq-linux64",
        "uncompress": false,
        "bin_dir_pattern": "",
        "copy_to_bin": true,
        "copy_source_name": "jq-linux64",
        "chmod": "+x"
    },
    {
        "name": "git-lfs",
        "user": "git-lfs",
        "repo": "git-lfs",
        "file_pattern": "git-lfs-linux-amd64-###.tar.gz",
        "uncompress_cmd": "tar",
        "uncompress_flags": "zxf",
        "uncompress": true,
        "bin_dir_pattern": "",
        "copy_to_bin": true
    },
    {
        "name": "starship",
        "user": "starship",
        "repo": "starship",
        "file_pattern": "starship-x86_64-unknown-linux-musl.tar.gz",
        "uncompress_cmd": "tar",
        "uncompress_flags": "zxf",
        "uncompress": true,
        "bin_dir_pattern": "",
        "copy_to_bin": true
    },
    {
        "name": "fd",
        "user": "sharkdp",
        "repo": "fd",
        "file_pattern": "fd-###-x86_64-unknown-linux-musl.tar.gz",
        "uncompress_cmd": "tar",
        "uncompress_flags": "zxf",
        "uncompress": true,
        "bin_dir_pattern": "fd-###-x86_64-unknown-linux-musl",
        "copy_to_bin": true
    },
    {
        "name": "exa",
        "user": "ogham",
        "repo": "exa",
        "file_pattern": "exa-linux-x86_64-###.zip",
        "uncompress_cmd": "unzip",
        "uncompress_flags": "-dexa",
        "uncompress": true,
        "bin_dir_pattern": "exa/bin",
        "copy_to_bin": true
    }
]
